{
  "schema_version": "0.1",
  "generated_at": "2026-06-02T07:23:04.738850Z",
  "source": {
    "spreadsheet_id": "1gp3jl_DyB8kvxHO7m4YjsCPbFTPGi-XKyqPhGAlTZ60",
    "spreadsheet_url": "https://docs.google.com/spreadsheets/d/1gp3jl_DyB8kvxHO7m4YjsCPbFTPGi-XKyqPhGAlTZ60/edit?ouid=112662517307801676490",
    "title": "[Day 1] 1.0 (from 20250707)",
    "source_artifacts": {
      "live_document_item_grouping_checkpoint": "live-document-item-grouping-checkpoint.json",
      "live_version_breakpoint_detection": "live-version-breakpoint-detection.json",
      "live_formula_result_authority_checkpoint": "live-formula-result-authority-checkpoint.json",
      "live_semantic_gate_iteration": "live-semantic-gate-iteration.json"
    }
  },
  "authority": {
    "source_document": "live_google_sheet",
    "packet_status": "review_packet_only",
    "parser_truth": "no_new_parser_claims",
    "shared_ontology_updates": 0
  },
  "method": {
    "name": "connected_sheets_carry_forward_review_packet",
    "authority": "review_packet_from_existing_carry_forward_artifacts",
    "decision_policy": "Group carry-forward queues into reviewer decision lanes. Do not accept grouping, formula, version, metric, semantic, or shared ontology claims."
  },
  "review_lanes": [
    {
      "id": "lane_document_item_grouping",
      "type": "review_lane",
      "title": "Document Item Grouping",
      "priority": "high",
      "status": "review_required",
      "description": "Structural grouping exists, but only formula/dataflow-backed groups are accepted.",
      "decision_item_count": 3,
      "total_evidence_item_count": 175,
      "decision_items": [
        {
          "id": "grouping_review_section_groups",
          "type": "review_decision_item",
          "lane": "document_item_grouping",
          "priority": "high",
          "status": "pending_human_review",
          "question": "Which section/text/table groupings should be accepted, split, or rejected before semantic storage?",
          "impact": "Accepted groups become the structural units consumed by semantic iteration.",
          "recommended_next_action": "Review representative section groups first, then decide whether ordering-only groups need visual capture or can stay review-required.",
          "total_item_count": 106,
          "sample_items": [
            {
              "id": "doc_item_section_block_25_0707_004",
              "kind": "section_with_child_blocks",
              "sheet": "25_0707",
              "range": "B14:K30",
              "label": "A. 월간 순매출 및 공헌이익",
              "review_reasons": [
                "section_grouping_uses_ordering_evidence_only",
                "needs_visual_or_user_confirmation_before_semantic_storage"
              ]
            },
            {
              "id": "doc_item_section_block_25_0707_007",
              "kind": "section_with_child_blocks",
              "sheet": "25_0707",
              "range": "B45:K61",
              "label": "B. 월간 비용 관리 (마케팅비 및 강사료)",
              "review_reasons": [
                "section_grouping_uses_ordering_evidence_only",
                "needs_visual_or_user_confirmation_before_semantic_storage"
              ]
            },
            {
              "id": "doc_item_section_block_25_0714_004",
              "kind": "section_with_child_blocks",
              "sheet": "25_0714",
              "range": "B14:K30",
              "label": "A. 월간 순매출 및 공헌이익",
              "review_reasons": [
                "section_grouping_uses_ordering_evidence_only",
                "needs_visual_or_user_confirmation_before_semantic_storage"
              ]
            },
            {
              "id": "doc_item_section_block_25_0714_007",
              "kind": "section_with_child_blocks",
              "sheet": "25_0714",
              "range": "B45:K61",
              "label": "B. 월간 비용 관리 (마케팅비 및 강사료)",
              "review_reasons": [
                "section_grouping_uses_ordering_evidence_only",
                "needs_visual_or_user_confirmation_before_semantic_storage"
              ]
            },
            {
              "id": "doc_item_section_block_25_0721_004",
              "kind": "section_with_child_blocks",
              "sheet": "25_0721",
              "range": "B14:K30",
              "label": "A. 월간 순매출 및 공헌이익",
              "review_reasons": [
                "section_grouping_uses_ordering_evidence_only",
                "needs_visual_or_user_confirmation_before_semantic_storage"
              ]
            },
            {
              "id": "doc_item_section_block_25_0721_007",
              "kind": "section_with_child_blocks",
              "sheet": "25_0721",
              "range": "B45:K61",
              "label": "B. 월간 비용 관리 (마케팅비 및 강사료)",
              "review_reasons": [
                "section_grouping_uses_ordering_evidence_only",
                "needs_visual_or_user_confirmation_before_semantic_storage"
              ]
            },
            {
              "id": "doc_item_section_block_25_0728_004",
              "kind": "section_with_child_blocks",
              "sheet": "25_0728",
              "range": "B14:K30",
              "label": "A. 월간 순매출 및 공헌이익",
              "review_reasons": [
                "section_grouping_uses_ordering_evidence_only",
                "needs_visual_or_user_confirmation_before_semantic_storage"
              ]
            },
            {
              "id": "doc_item_section_block_25_0728_008",
              "kind": "section_with_child_blocks",
              "sheet": "25_0728",
              "range": "B45:K61",
              "label": "B. 월간 비용 관리 (마케팅비 및 강사료)",
              "review_reasons": [
                "section_grouping_uses_ordering_evidence_only",
                "needs_visual_or_user_confirmation_before_semantic_storage"
              ]
            },
            {
              "id": "doc_item_section_block_25_0728_010",
              "kind": "section_with_child_blocks",
              "sheet": "25_0728",
              "range": "B76:S80",
              "label": "C. 주간 신규 런칭 타율 및 주간 매출",
              "review_reasons": [
                "section_grouping_uses_ordering_evidence_only",
                "needs_visual_or_user_confirmation_before_semantic_storage"
              ]
            },
            {
              "id": "doc_item_section_block_25_0804_004",
              "kind": "section_with_child_blocks",
              "sheet": "25_0804",
              "range": "B14:K30",
              "label": "A. 월간 순매출 및 공헌이익",
              "review_reasons": [
                "section_grouping_uses_ordering_evidence_only",
                "needs_visual_or_user_confirmation_before_semantic_storage"
              ]
            },
            {
              "id": "doc_item_section_block_25_0804_007",
              "kind": "section_with_child_blocks",
              "sheet": "25_0804",
              "range": "B45:K61",
              "label": "B. 월간 비용 관리 (마케팅비 및 강사료)",
              "review_reasons": [
                "section_grouping_uses_ordering_evidence_only",
                "needs_visual_or_user_confirmation_before_semantic_storage"
              ]
            },
            {
              "id": "doc_item_section_block_25_0804_009",
              "kind": "section_with_child_blocks",
              "sheet": "25_0804",
              "range": "B76:S80",
              "label": "C. 주간 신규 런칭 타율 및 주간 매출",
              "review_reasons": [
                "section_grouping_uses_ordering_evidence_only",
                "needs_visual_or_user_confirmation_before_semantic_storage"
              ]
            },
            {
              "id": "doc_item_section_block_25_0811_004",
              "kind": "section_with_child_blocks",
              "sheet": "25_0811",
              "range": "B14:U33",
              "label": "A. 월간 순매출 및 공헌이익",
              "review_reasons": [
                "section_grouping_uses_ordering_evidence_only",
                "needs_visual_or_user_confirmation_before_semantic_storage"
              ]
            },
            {
              "id": "doc_item_section_block_25_0811_006",
              "kind": "section_with_child_blocks",
              "sheet": "25_0811",
              "range": "B45:K61",
              "label": "B. 월간 비용 관리 (마케팅비 및 강사료)",
              "review_reasons": [
                "section_grouping_uses_ordering_evidence_only",
                "needs_visual_or_user_confirmation_before_semantic_storage"
              ]
            },
            {
              "id": "doc_item_section_block_25_0811_008",
              "kind": "section_with_child_blocks",
              "sheet": "25_0811",
              "range": "B76:S80",
              "label": "C. 주간 신규 런칭 타율 및 주간 매출",
              "review_reasons": [
                "section_grouping_uses_ordering_evidence_only",
                "needs_visual_or_user_confirmation_before_semantic_storage"
              ]
            }
          ],
          "evidence_refs": [
            "live-document-item-grouping-checkpoint.json"
          ]
        },
        {
          "id": "grouping_review_formula_pipeline_groups",
          "type": "review_decision_item",
          "lane": "document_item_grouping",
          "priority": "high",
          "status": "blocked_by_formula_authority",
          "question": "Which FC_DATA-dependent formula pipeline groups can be accepted after formula-result authority is resolved?",
          "impact": "These groups should not become semantic report surfaces until output authority is available.",
          "recommended_next_action": "Resolve formula-result authority first; then re-run grouping acceptance for blocked pipeline groups.",
          "total_item_count": 20,
          "sample_items": [
            {
              "id": "doc_item_pipeline_pipeline_25_0707_cross_sheet_range_fc_data",
              "kind": "formula_dataflow_pipeline_group",
              "sheet": "25_0707",